"Standard Name",Description,Type,Category,Status,"Deployment Type"
"Oracle Data Access Components (ODAC) 12c Rel 4","Oracle Data Access Components are a set of Windows data access drivers and tools. They include support for .NET, COM, and ODBC data access; Microsoft Visual Studio tools for developing Oracle database applications; ASP.NET providers; and .NET stored procedure support.",Software,"Development Tool",Exception,Desktop
"Oracle Database 10g","Oracle Database (commonly referred to as Oracle RDBMS or simply as Oracle) is an object-relational database management system produced and marketed by Oracle Corporation.",Software,Database,Sunsetting,Server
"Oracle Database 11g","Oracle Database (commonly referred to as Oracle RDBMS or simply as Oracle) is an object-relational database management system produced and marketed by Oracle Corporation.",Software,Database,"Approved - Preferred",Server
"Oracle Database 12c","Oracle Database 12c introduces a new multitenant architecture that makes it easy to consolidate many databases quickly and manage them as a cloud service. Oracle Database 12c also includes in-memory data processing capabilities for breakthrough analytical performance. Additional database innovations deliver new levels of efficiency, performance, security, and availability. Oracle Database 12c comes in two editions to fit your business needs and budget: Enterprise Edition and Standard Edition 2.",Software,Database,"Not yet submitted",Server
"Oracle Database 8i","Integrated and flexible set of development tools and servers for delivering e-business solutions.",Software,Database,Sunsetting,Server
"Oracle Database Client 11g","Client (UI) for Oracle Databases.",Software,Database,"Approved - Maintain",Desktop
"Oracle DataProvider for .NET 11g","The Oracle Data Provider for .NET (ODP.NET) features optimized data access to the Oracle database from a .NET environment.",Software,"Database Connectivity","Not yet submitted",Server
"Oracle Developer Suite 10g","Oracle Developer Suite is a suite of development tools released by the Oracle Corporation. The principal components were initially Oracle Forms and Oracle Reports, although the suite was later expanded to include JDeveloper amongst others.",Software,"IDE-Integrated Development Environment",Sunsetting,Desktop
"Oracle Developer Suite 11g","Oracle Developer Suite is the most complete and integrated development environment, combining the power of application development and business intelligence tools in a single suite that is based on the latest industry standards. Oracle Developer Suite lets developers quickly build high-quality transactional applications, which can be deployed to multiple channels - including portals, Web services, and wireless devices, and which can be extended with business intelligence capabilities - including ad hoc query and analysis, high-quality Web reporting, and advanced analysis. Developer Suite Components:Oracle JDeveloperOracle ReportsOracle FormsOracle DiscovererOracle DesignerOracle Business Intelligence BeansDeveloper Suite Software Configuration Manager",Software,"IDE-Integrated Development Environment","Not yet submitted",Desktop
"Oracle Developer Tools (ODT) for Visual Studio 12.1.0.2.4","The Oracle Developer Tools for Visual Studio (ODT) is a tightly integrated ""Add-in"" for Microsoft Visual Studio. ODT is free and supports Visual Studio 2015, 2013, and VS 2012.",Software,"Development Tool",Exception,Desktop
"Oracle Directory Server Enterprise Edition 11g","Oracle Directory Server Enterprise Edition (formerly SUN Directory Server Enterprise Edition) is the best known directory server with proven large deployments in carrier and enterprise environments. It is also the most supported directory by ISVs, so it is ideal for heterogeneous environments. ODSEE provides a core directory service with embedded database, directory proxy, Active Directory (AD) synchronization and a Web administration console.",Software,"Identity and Access Management","Approved - Preferred",Server
"Oracle Directory Services Manager 11g","Oracle Directory Service Manager (ODSM) is a tool to manage Oracle Internet Directory (OID) and Oracle Virtual Directory (OVD).",Software,"Identity and Access Management","Approved - Preferred",Server
"Oracle Discoverer Admin Edition 11g","Oracle Discoverer is a tool-set for ad hoc querying, reporting, data analysis, and Web-publishing for the Oracle Database environment. Oracle Corporation markets it as a business intelligence product. It was originally a stand-alone product, however it has become a component of the Oracle Fusion Middleware suite, and renamed Oracle Business Intelligence Discoverer.Administration Edition: The Administration Edition is used to create and maintain the ""End User Layer"" (EUL) which is a metadata layer that hides the complexity of the database from end users.",Software,"Reporting and Analysis","Approved - Maintain",Server
"Oracle Discoverer Portlet Software Development Kit 11g","Portlets are reusable information components that summarize or provide access to different types of information sources. You can customize the appearance of portlets on a per user or per group basis. Discoverer portlet can be used to link a portal to an existing Discoverer worksheet.",Software,"Reporting and Analysis","Approved - Maintain",Server
"Oracle Discovery Tools 12.3","The Memory Error Discovery Tool (Discover) software is an advanced development tool for detecting memory access errors. Discover works on binaries compiled with the Sun Studio 12 Update 1, Oracle Solaris Studio 12.2, or Oracle Solaris Studio 12.3 compilers; or the GCC for Sun Systems compilers starting with version 4.2.0. It works on systems running the Solaris 10 10/08 operating system or a later Solaris 10 update, or Oracle Solaris 11.",Software,"Reporting and Analysis","Approved - Maintain",Server
"Oracle Enterprise Single Sign-On 11g","A suite of best-in-class products that simplifies enterprise single sign-on deployments for system administrators and extends the benefits of ESSO to remote and mobile users. Provides users with unified sign-on and authentication across all their enterprise resources, including desktops, client-server, custom, and host-based mainframe applications. Provides a centralized framework for security and compliance enforcement. Eliminates the need for multiple usernames and passwords. Helps enforce strong password and authentication policies. Uses any LDAP directory, Active Directory, or any SQL database server as its user profile and credential repository,",Software,"Identity and Access Management",Denied,Server
"Oracle Entitlements Server 11g","Oracle Entitlements Server is an entitlements system that supports the centralized definition of complex application entitlements and the distributed runtime enforcement of those entitlements. It allows you to externalize entitlements – remove security decisions from the application. It provides the means to define application resources and application businesses objects, represent those objects in hierarchical relationships, and write policies that describes which users, groups and roles can access those objects. You can write policies that control access to both application software components as well as arbitrary business objects in the application. Oracle Entitlements Server also includes a security integration framework that provides an easy way to integrate with existing authentication, Web SSO, identity management, and user provisioning systems.",Software,"Identity and Access Management","Approved - Maintain",Server
"Oracle Federal HR","Oracle US Federal Human Resources (HR) enables federal agencies to optimize human capital resources. It is a proactive management tool that allows US Federal agencies to control costs and fully support an effective workforce. It allows you to adopt structured approaches for attracting, retaining, developing and using the critical skills and knowledge needed to improve the capability of your mission and meet new challenges. Oracle US Federal Human Resources is part of the Oracle E-Business Suite, an integrated set of applications that are engineered to seamlessly work together.",Software,"Miscellaneous Software","Not yet submitted",SaaS
"Oracle Forms and Report Developer 11g","Tool used to create forms and build enterprise-level reports rapidly and productively.",Software,"Survey and Form Designer","Not yet submitted",Server
"Oracle HTTP Server 11g","The Oracle HTTP server is a simple Web HTTPD server (Web listener). It is based on the Apache Web Server provided by the Apache Group (www.apache.org). Both the Oracle database (8.1.7 and above) and Oracle iAS (Oracle Internet Application Server) ships with the Oracle HTTP Server.",Software,"Web Servers","Not yet submitted",Server
"Oracle Identity Analytics 11g","Oracle Identity Analytics provides enterprises with the ability to define and manage roles and automate critical identity-based controls.",Software,"Identity and Access Management","Approved - Preferred",Server
"Oracle Identity Federation 11g","Oracle Identity Federation (OIF) is a complete, enterprise-level solution for secure identity information exchange between partners. OIF reduces account management for partner identities and lowers the cost of integrations through support of industry federation standards. Oracle Identity Federation protects existing IT investments by integrating with a wide variety of data stores, user directories, authentication providers and applications.",Software,"Identity and Access Management","Approved - Preferred",Server
"Oracle Identity Manager 11g","Oracle Identity Manager (OIM) enables enterprises to manage the entire user lifecycle across all enterprise resources both within and beyond a firewall. An Oracle identity management solution provides a mechanism for implementing the user management aspects of a corporate policy. It can also be a means to audit users and their access privileges",Software,"Identity and Access Management","Approved - Preferred",Server
"Oracle Internet Directory 11g","Oracle Internet Directory (OID) is a directory service produced by Oracle Corporation, which functions compatible with LDAP version 3.",Software,"Identity and Access Management","Approved - Preferred",Server
"Oracle Java Enterprise Edition 5","Support for encryption includes symmetric, asymmetric, block, and stream ciphers. This package also supports secure streams and sealed objects.",Software,"Identity and Access Management,Programming Environment",Denied,Server
"Oracle Java Enterprise Edition 6","Many of the classes provided in this package are provider-based. The class itself defines a programming interface to which applications may write. The implementations themselves may then be written by independent third-party vendors and plugged in seamlessly as needed. Therefore application developers may take advantage of any number of provider-based implementations without having to add or rewrite code.",Software,"Identity and Access Management,Programming Environment",Denied,Server
"Oracle Java Enterprise Edition 7","Java Platform, Standard Edition or Java SE is a widely used platform for development and deployment of portable applications for desktop and server environments. Java SE uses the object-oriented Java programming language. It is part of the Java software platform family. Java SE defines a wide range of general purpose APIs – such as Java APIs for the Java Class Library – and also includes the Java Language Specification and the Java Virtual Machine Specification.",Software,"Programming Environment","Approved - Maintain",Desktop
"Oracle Java Enterprise Edition 8","Java Platform, Enterprise Edition (Java EE) is the standard in community-driven enterprise software. Java EE is developed using the Java Community Process, with contributions from industry experts, commercial and open source organizations, Java User Groups, and countless individuals. Each release integrates new features that align with industry needs, improves application portability, and increases developer productivity.Today, Java EE offers a rich enterprise software platform, and with over 20 compliant Java EE 6 implementations to choose from, low risk and plenty of options.",Software,"Programming Language","Approved - Preferred",Desktop
"Oracle Java SE JDK 1.3","Java Platform, Standard Edition or Java SE is a widely used platform for development and deployment of portable applications for desktop and server environments. Java SE uses the object-oriented Java programming language. It is part of the Java software platform family. Java SE defines a wide range of general purpose APIs such as Java APIs for the Java Class Library and also includes the Java Language Specification and the Java Virtual Machine Specification.",Software,"Programming Language",Denied,Desktop
"Oracle Java SE JDK 1.4","Java Platform, Standard Edition or Java SE is a widely used platform for development and deployment of portable applications for desktop and server environments. Java SE uses the object-oriented Java programming language. It is part of the Java software platform family. Java SE defines a wide range of general purpose APIs such as Java APIs for the Java Class Library and also includes the Java Language Specification and the Java Virtual Machine Specification.",Software,"Programming Language",Denied,Server
"Oracle Java SE JDK 6","Java Platform, Standard Edition (Java SE) lets you develop and deploy Java applications on desktops and servers, as well as in today's demanding embedded environments. Java offers the rich user interface, performance, versatility, portability, and security that today's applications require.",Software,"Programming Language",Sunsetting,Desktop
"Oracle Java SE JDK 7","The Java Development Kit (JDK) is an implementation of either one of the Java SE, Java EE or Java ME platforms released by Oracle Corporation in the form of a binary product aimed at Java developers on Solaris, Linux, Mac OS X or Windows. The JDK includes a private JVM and a few other resources to finish the development of a Java Application. Since the introduction of the Java platform, it has been by far the most widely used Software Development Kit (SDK). On 17 November 2006, Sun announced that it would be released under the GNU General Public License (GPL), thus making it free software. This happened in large part on 8 May 2007, when Sun contributed the source code to the OpenJDK.",Software,"Programming Environment,Programming Language","Approved - Maintain",Desktop
"Oracle Java SE JDK 8","The Java Development Kit (JDK) is an implementation of either one of the Java SE, Java EE or Java ME platforms released by Oracle Corporation in the form of a binary product aimed at Java developers on Solaris, Linux, Mac OS X or Windows. The JDK includes a private JVM and a few other resources to finish the development of a Java Application. Since the introduction of the Java platform, it has been by far the most widely used Software Development Kit (SDK).",Software,"Programming Environment,Programming Language","Approved - Preferred",Desktop
"Oracle Java SE JRE 6","Runtime environment for Java-based applications.",Software,"Runtime Library",Sunsetting,Desktop
"Oracle Java SE JRE 7","Runtime environment for Java-based applications.",Software,"Runtime Library","Approved - Maintain",Desktop
"Oracle Java SE JRE 8","Runtime environment for Java-based applications.",Software,"Runtime Library","Approved - Preferred",Desktop
"Oracle JDeveloper 11","Comprehensive, integrated environment for design, development, debugging, profiling, and deployment of Java solutions such as business applications and web services",Software,"IDE-Integrated Development Environment",Exception,Server
"Oracle MySQL Community Edition 5.6","MySQL Community Edition is a freely downloadable version of the world's most popular open source database that is supported by an active community of open source developers and enthusiasts.",Software,Database,Exception,Desktop
"Oracle MySQL Workbench 6","Unified visual tool for database architects, developers, and DBAs. Specific for MySQL that provides data modeling, SQL development, and comprehensive administration tools for server configuration, user administration, backup, and much more. RT2016-87411RITM0287619",Software,"Database Admin Tools",Exception,Desktop
"Oracle MySQL Workbench SE 5.2","MySQL Workbench is a unified visual tool for database architects, developers, and DBAs. MySQL Workbench provides data modeling, SQL development, and comprehensive administration tools for server configuration, user administration, backup, and much more. MySQL Workbench is available on Windows, Linux and Mac OS X.",Software,"Database Connectivity","Approved - Maintain",Desktop
"Oracle OC4J 10","Oracle Containers for J2EE (OC4J) is the core J2EE runtime component of Oracle Application Server.",Software,"Programming Environment,Runtime Library","Not yet submitted",Server
"Oracle OpenSSO Enterprise Policy Agent 3.0","Access control in Sun OpenSSO Enterprise is enforced using agents. Agents protect content on designated deployment containers, such as web servers and application servers, from unauthorized intrusions. Agents are separate from OpenSSO Enterprise.",Software,"Identity and Access Management",Denied,Server
"Oracle PL/SQL","PL/SQL (Procedural Language/Structured Query Language) is Oracle Corporation's procedural language extension for SQL and the Oracle relational database.",Software,Database,"Not yet submitted",Server
"Oracle Portal 11g","Oracle Portal 11g offers a complete portal framework for building, deploying, and managing portals that are tightly integrated with Oracle WebLogic Server. Oracle Portal 11g provides a rich, declarative environment for creating a portal Web interface and accessing dynamic data with an extensible framework for J2EE-based enterprise application access.",Software,"Portal Content Management","Not yet submitted",Server
"Oracle Siebel CRM 8.0.x","Customer relationship management (CRM) solution.",Software,"Customer Relationship Management",Denied,Server
"Oracle Solaris 10","Solaris is a Unix operating system originally developed by Sun Microsystems. It superseded their earlier SunOS in 1993. Oracle Solaris, as it is now known, has been owned by Oracle Corporation since Oracle's acquisition of Sun in January 2010. Solaris is known for its scalability, especially on SPARC systems, and for originating many innovative features such as DTrace, ZFS and Time Slider. Solaris supports SPARC-based and x86-based workstations and servers from Oracle and other vendors, with efforts underway to port to additional platforms",Software,"Network Operating System","Not yet submitted",Server
"Oracle Solaris 11","Solaris is a Unix operating system originally developed by Sun Microsystems. It superseded their earlier SunOS in 1993. Oracle Solaris, as it is now known, has been owned by Oracle Corporation since Oracle's acquisition of Sun in January 2010. Solaris is known for its scalability, especially on SPARC systems, and for originating many innovative features such as DTrace, ZFS and Time Slider. Solaris supports SPARC-based and x86-based workstations and servers from Oracle and other vendors, with efforts underway to port to additional platforms",Software,"Network Operating System","Approved - Maintain",Server
"Oracle SQL Developer 3","Oracle SQL Developer is an Integrated development environment (IDE) for working with SQL in Oracle databases. Oracle Corporation provides this product free; it uses the Java Development Kit.",Software,"Database Connectivity","Approved - Preferred",Desktop
"Oracle Tuxedo 11g","Transactions Under UNIX Extended for Distributed Operations, a transaction processing monitor in the UNIX client/server environment.",Software,"Programming Environment","Approved - Preferred",Server
"Oracle Virtual Directory 11g","Oracle Virtual Directory provides Internet and industry-standard LDAP and XML views of existing enterprise identity information, without synchronizing or moving data from its native locations.",Software,"Identity and Access Management","Approved - Preferred",Server
"Oracle VirtualBox 5.0","Oracle VM VirtualBox (formerly Sun VirtualBox, Sun xVM VirtualBox and Innotek VirtualBox) is a free and open-source hypervisor for x86 computers from Oracle Corporation. Developed initially by Innotek GmbH, it was acquired by Sun Microsystems in 2008 which was in turn acquired by Oracle in 2010.",Software,"Database Admin Tools",Proposed,Server
"Oracle WebLogic Server 10.3","Application server for developing and deploying applications across conventional and cloud environments.",Software,"Application Servers,Web Servers","Not yet submitted",Server
"Oracle WebLogic Server 9","Oracle WebLogic Server is a Java EE application server currently developed by Oracle Corporation. Oracle acquired WebLogic Server when it purchased BEA Systems in 2008.",Software,"Application Servers,Web Servers",Sunsetting,Server
"Oracle Workflow 2","Oracle  Workflow delivers a complete workflow management system that supports business process based integration. Its technology enables modeling, automation, and continuous improvement of business processes, routing information of any type according to user-defined business rules. The heart of Oracle Workflow is the rules-based workflow engine residing in the Oracle9i database.",Software,Database,"Approved - Maintain",Server
"OWASP Zed Attack Proxy Project (ZAP)","The OWASP Zed Attack Proxy (ZAP) is an easy to use integrated penetration testing tool for finding vulnerabilities in web applications. It is designed to be used by people with a wide range of security experience and as such is ideal for developers and functional testers who are new to penetration testing.",Software,"Security and Assurance",Proposed,Desktop
"PDF Mergy","Merges PDF files with a simple drag and drop interface directly in the browser. This WebApp lets you either select the files you want to merge from your computer or drop them on the app using drag and drop. After that use drag and drop to bring the files in the desired order. Supports Google Drive.Use internal PDF editor (Adobe)",Software,"Electronic Publishing",Denied,SaaS
"Pentaho Data Integration (Community) 6.0","Data Integration (or Kettle) delivers powerful Extraction, Transformation, and Loading (ETL) capabilities, using a groundbreaking, metadata-driven approach.",Software,"Reporting and Analysis",Exception,Desktop
"PERL 5","Perl is a family of high-level, general-purpose, interpreted, dynamic programming languages.",Software,"Dynamic Server Side Display",Sunsetting,Server
"PerSoft Childcare Manager","This program keeps track of the children enrolled, their birthdays, parents, schedules, the amount they pay for tuition.",Software,"Miscellaneous Software",Proposed,Desktop
"Perspective Software ImageNow 6","Offers instant, single-click access to digitized versions of paper and other electronic documents from any existing software application.",Software,"Document Management",Exception,Desktop
"pgAdmin.org pgAdmin 1.20","pgAdmin is the most popular and feature rich Open Source administration and development platform for PostgreSQL, the most advanced Open Source database in the world. The application may be used on Linux, FreeBSD, Solaris, Mac OSX and Windows platforms to manage PostgreSQL 7.3 and above running on any platform, as well as commercial and derived versions of PostgreSQL.",Software,"IDE-Integrated Development Environment",Exception,Desktop
"PGP Desktop 10","Pretty Good Privacy (PGP) is a data encryption and decryption computer program that provides cryptographic privacy and authentication for data communication. PGP is often used for signing, encrypting, and decrypting texts, e-mails, files, directories, and whole disk partitions and to increase the security of e-mail communications. PGP Desktop is now known as Symantec Encryption Desktop.",Software,"Certificates / Digital Signature","Approved - Maintain",Desktop
"Philips SpeechExec Pro 7","Dictation and speech recognition.",Software,"Speech Recognition","Approved - Maintain",Desktop
"PhishMe Simulator","PhishMe solution disrupts the core of the adversary’s attack chain their targets and tactics. The powerful combination of Simulator-Reporter-Triage reduces the success and resolution time of phishing attacks and provides an additional safety net by operationalizing a program of human security sensors with a detection mechanism that is based on user-generated intelligence derived in near real-time.RT2016-87434RITM0299512",Software,"Security and Assurance",Proposed,Server
"PHP 7","PHP is a server-side scripting language designed for web development but also used as a general-purpose programming language. Originally created by Rasmus Lerdorf in 1994,the PHP reference implementation is now produced by The PHP Group.While PHP originally stood for Personal Home Page, it now stands for the recursive backronym PHP: Hypertext Preprocessor.",Software,"Web Servers","Not yet submitted",Server
"PHPBB 3","PHPBB is a free flat-forum bulletin board software solution that can be used to stay in touch with a group of people or can power your entire website. With an extensive database of user-created modifications and styles database containing hundreds of style and image packages to customise your board, you can create a very unique forum in minutes.",Software,"Collaboration Software","Not yet submitted",Server
